{
    "WorkloadName": "lcls",
    "PayloadSize": 1000000,
    "PayloadFormat": "hdf5",
    "PayloadElement": "file",
    "DataRate": 3750000,
    "DataPackaging": {
    "type": "individual"
  },
    "Variability": "steady",
    "ConsumptionMode": "push", 
    "NumConsumers": 2, 
    "ConsumerParallelism": "dedicatedMPI",
    "ConsPayloadDistribution": "roundrobin",
    "NumProducers": 2,
    "ProducerParallelism": "dedicatedMPI"
  }